8,ศาลเจ้าพ่อเทพารักษ์หลักเมือง,สถานที่อันศักดิ์สิทธิ์และเป็นที่เคารพสักการะของชาวขอนแก่นแห่งนี้ประดิษฐานอยู่ที่ศาลาสุขใจ ถนนเทพารักษ์หน้าเทศบาลขอนแก่น ท่านเจ้าคุณปู่พระราชสารธรรมมุนี และหลวงธุรนัยพินิจ อดีตผู้ว่าราชการจังหวัดขอนแก่นได้ริเริ่มสร้างขึ้นโดยนำหลักศิลาจารึกจากโบราณสถานในท้องที่อำเภอชุมแพมาประกอบพิธีทางพุทธศาสนา และตั้งเป็นศาลหลักเมืองเมื่อวันที่ 20 สิงหาคม พ.ศ. 2499,ประวัติศาสตร์,ขอนแก่น,เมืองขอนแก่น,ในเมือง,ถนนศรีจันทร์,40000,0,0,กลุ่มครอบครัว/กลุ่มวัยทำงาน/กลุ่มนักเรียนนักศึกษา/เยาวชน/วัยรุ่น/กลุ่มคู่รัก / คู่แต่งงาน/ทุกช่วงวัย,รถยนต์/มอเตอร์ไซค์/,ลานจอดรถ/ลานจอดรถ/สุขา/ร้านอาหาร/ศูนย์บริการนักท่องเที่ยว/ร้านขายสินค้าที่ระลึก/มัคคุเทศก์ท้องถิ่น/ป้ายสื่อความหมาย/ป้ายชี้ทางเข้าถึง/ที่พักสัตว์เลี้ยง(สุนัข)/ที่พักสัตว์เลี้ยง(แมว)/ที่พักสัตว์เลี้ยง(อื่นๆ)/,0 4322 7523,ไม่ทราบ,ไม่ทราบ,เปิดบริการทุกวัน
9,กู่ประภาชัย,กู่จะอยู่ภายในวัดกู่บ้านนาคำน้อย หรือจะขับรถข้ามสะพานข้ามคลองส่งน้ำ ตรงไปตามถนนลาดยางประมาณ 6 กิโลเมตร ก็จะมีป้ายบอกทางให้เลี้ยวซ้ายผ่านหมู่บ้านไปประมาณ 1 กิโลเมตร ก็จะถึงกู่ประภาชัย กู่ประภาชัย คือกลุ่มโบราณสถานที่มีลักษณะแผนผังอย่างเดียวกันกับโบราณสถานที่พบหลักฐานแสดงอโรคยาศาลหรือสถานพยาบาลที่พระเจ้าชัยวรมันที่ 7 แห่งอาณาจักรเขมรโบราณโปรดฯให้สร้างขึ้นในพุทธศตวรรษที่ 18 (พ.ศ. 1720 1780) คือประกอบด้วยปรางค์ประธานรูปสี่เหลี่ยมจตุรัส มีมุขยื่นทางด้านหน้า ด้านขวามือเยื้องไปข้างหน้าเป็นอาคารรูปสี่เหลี่ยมที่เรียกว่า บรรณาลัย อาคารทั้งสองล้อมรอบด้วยกำแพงแก้วโดยมีโคปุระหรือซุ้มประตูทางเข้าออกด้านหน้าหรือทางด้านทิศตะวันออกเพียงด้านเดียว นอกกำแพงที่มุมซ้ายมีสระน้ำ 1 สระทั้งหมดสร้างด้วยศิลาแลง โดยมีเสาประดับประตู ทับหลังเป็นหินทราย ปัจจุบันหักพังแต่ได้รับการดูแลรักษาจากทางวัดเป็นอย่างดี ซึ่งได้ขึ้นทะเบียนเป็นโบราณสถานเมื่อวันที่ 8 มีนาคม พ.ศ.2478,ประวัติศาสตร์,ขอนแก่น,น้ำพอง,บัวใหญ่,หมู่ 1 บ้านนาคำน้อย,40140,0,0,กลุ่มครอบครัว/,รถยนต์/,ลานจอดรถ/ลานจอดรถ/สุขา/ร้านอาหาร/ศูนย์บริการนักท่องเที่ยว/ร้านขายสินค้าที่ระลึก/มัคคุเทศก์ท้องถิ่น/ป้ายสื่อความหมาย/ป้ายชี้ทางเข้าถึง/ที่พักสัตว์เลี้ยง(สุนัข)/ที่พักสัตว์เลี้ยง(แมว)/ที่พักสัตว์เลี้ยง(อื่นๆ)/,"08 3362 9844, 08 1546 7797",ไม่ทราบ,ไม่ทราบ,เปิดทุกวัน
10,ถนนฅนเดิน ขอนแก่น,ถนนคนเดินขอนแก่น เปิดทุกวันเสาร์ ซึ่งเค้าจะปิดถนนยาวเลยตั้งแต่หน้าสำนักงานอุตสาหกรรมจังหวัดขอนแก่นไปจนถึงหน้าสำนักงานที่ดินจังหวัดขอนแก่น ถนนคนเดินที่นี่เดินกันเมื่อยเลยทีเดียว ภายในตลาดมีทั้งอาหาร เครื่องดื่ม เสื้อผ้า ของใช้ ของตกแต่ง งานศิลปะ สินค้าแฮนด์เมด ผ้าทอ และอีกมากมาย รวมทั้งจัดโตีะนั่งทานอาหารไว้ให้ด้วย สามารถเดินไปซื้ออาหารแล้วมานั่งทานได้ มีโต๊ะนั่งอยู่มากพอสมควร,อาหาร ช้อปปิ้ง,ขอนแก่น,เมืองขอนแก่น,ในเมือง,ซอย หน้าศูนย์ราชกาล,40000,0,0,กลุ่มครอบครัว/กลุ่มวัยทำงาน/กลุ่มนักเรียนนักศึกษา/เยาวชน/วัยรุ่น/กลุ่มคู่รัก / คู่แต่งงาน/ทุกช่วงวัย,รถยนต์/รถโดยสารประจำทาง/เดินเท้า/มอเตอร์ไซค์/จักรยาน/,ลานจอดรถ/ลานจอดรถ/สุขา/ร้านอาหาร/ศูนย์บริการนักท่องเที่ยว/ร้านขายสินค้าที่ระลึก/มัคคุเทศก์ท้องถิ่น/ป้ายสื่อความหมาย/ป้ายชี้ทางเข้าถึง/ที่พักสัตว์เลี้ยง(สุนัข)/ที่พักสัตว์เลี้ยง(แมว)/ที่พักสัตว์เลี้ยง(อื่นๆ)/,0 4332 1152,ไม่ทราบ,ไม่ทราบ,เปิดบริการทุกวันเสาร์ เวลา 17.00-22.30 น. (ปิดตลาดช่วงเทศกาลงานไหมและประเพณีผูกเสี่ยว)
11,ตลาดต้นตาล,"ตลาดต้นตาล เทรนการช็อปปิ้งแนวใหม่ที่ไม่ใช่เพียงที่ช็อปปิ้ง มีพื้นที่ส่วนกลางสำหรับ เวทีการแสดง แสง สี เสียง ครบครัน ในบรรยากาศสวนร่มรื่น และสินค้าที่นำมาขายจะถูกคัดสรรค์มาอย่างดี เพื่อตอบสนองความต้องการของนักช็อปฯตัวจริง เปิดทุกวันยามเย็น 16:00 23:00น. ที่จอดรถยนต์และมอร์เตอร์ไซด์รวมกันกว่า 1,500คัน เข้า ออกสะดวกทั้งทางถนนมิตรภาพและถนนบ้านก่อกซอย 8, 10 หรือ 12 ดูน้อยลง",อาหาร ช้อปปิ้ง,ขอนแก่น,เมืองขอนแก่น,ในเมือง,381/58 หมู่ 17 ถนนมิตรภาพ,40000,0,0,กลุ่มครอบครัว/กลุ่มวัยทำงาน/กลุ่มนักเรียนนักศึกษา/เยาวชน/วัยรุ่น/กลุ่มคู่รัก / คู่แต่งงาน/ทุกช่วงวัย,รถยนต์/เดินเท้า/มอเตอร์ไซค์/,ลานจอดรถ/ลานจอดรถ/สุขา/ร้านอาหาร/ศูนย์บริการนักท่องเที่ยว/ร้านขายสินค้าที่ระลึก/มัคคุเทศก์ท้องถิ่น/ป้ายสื่อความหมาย/ป้ายชี้ทางเข้าถึง/ที่พักสัตว์เลี้ยง(สุนัข)/ที่พักสัตว์เลี้ยง(แมว)/ที่พักสัตว์เลี้ยง(อื่นๆ)/,"0 4300 0179, 08 3284 5351",tontannmarket@gmail.com,www.tontannmarket.com,เปิดบริการทุกวัน เวลา 16.00-23.00 น. (โซนลานเบียร์ปิด 24.00 น.)
12,ออร่าฟาร์ม,ออร่า ฟาร์ม” ที่เที่ยวแห่งใหม่ในอำเภอเขาสวนกวาง จังหวัดขอนแก่น ด้วยความสวยงามของบรรยากาศ และกิจกรรมการท่องเที่ยวที่หลากหลาย ทั้งแนวถ่ายภาพสวยและแนวฟาร์มเกษตร ภายในของออร่าฟาร์มแบ่งออกเป็น 2 ส่วน ส่วนแรกเป็นท่องเที่ยว มีทั้งหมด 4 โซนด้วยกัน ได้แก่ โซนออร่า การ์เดน โซนสวนเทพนิยาย โซนสถานี ออร่า ฟาร์ม และโซนหมู่บ้านออร่า ฟาร์ม ส่วนที่ 2 คือ ศูนย์การเรียนรู้ ใครที่ต้องการกำลังมองหาแหล่งการเรียนรู้ด้านเกษตรกรแล้วละก็ ส่วนนี้คงเหมาะสำหรับคุณ เพราะมีการเรียนรู้ทั้งหลักสูตรพื้นฐาน โดยจะแบ่งเป็นฐานการเรียนรู้ต่างๆ เช่น ฐานการแปรรูปนม เรียนรู้การทำชีส ไอศกรีม ฐานการเกษตร เรียนรู้การปลูกผักออร์แกนิค ฐานปศุสัตว์โคนม เรียนรู้การรีดนมวัว และหลักสูตรเฉพาะ ได้แก่ เกษตรอินทรีย์ การผลิตไอศกรีม และการเลี้ยงโคนม ภาคปฏิบัติ โดยการเข้าชมในส่วนนี้เราจะได้นั่งรถฟาร์มทัวร์ไปพร้อมกับฟังคำบรรยายจากไกด์ไปด้วย,บันเทิง,ขอนแก่น,เขาสวนกวาง,คำม่วง,108 หมู่ 1 ถนนมิตรภาพ,40280,30,50,กลุ่มครอบครัว/กลุ่มวัยทำงาน/กลุ่มนักเรียนนักศึกษา/เยาวชน/วัยรุ่น/,รถยนต์/รถไฟ/รถโดยสารประจำทาง/เดินเท้า/มอเตอร์ไซค์/จักรยาน/,,08 7716 9669,aurafarm187@gmail.com,www.aura-farm.com www.facebook.com/Aurafarm187/,ทุกวัน 09.00 -17.30 น.
13,ไดโนวอเตอร์พาร์ค,สวนสนุก/สวนน้ำ,บันเทิง,ขอนแก่น,เมืองขอนแก่น,โคกสี,456 หมู่ 12 ถนนมิตรภาพ,40000,300,400,กลุ่มครอบครัว/กลุ่มวัยทำงาน/กลุ่มนักเรียนนักศึกษา/เยาวชน/วัยรุ่น/กลุ่มคู่รัก / คู่แต่งงาน/ทุกช่วงวัย,รถยนต์/รถไฟ/รถโดยสารประจำทาง/มอเตอร์ไซค์/จักรยาน/,ลานจอดรถ/สุขา/ร้านอาหาร/,"085 002 6565,",Khonkaendino265@gmail.com,www.dinowaterpark.com,เปิดบริการทุกวัน เวลา 10.00-18.00 น.
14,สวนสัตว์ขอนแก่น,"สวนสัตว์ขอนแก่นเดิม ชื่อว่า อุทยานสัตว์ป่าอีสานตอนบนขอนแก่น–อุดรธานี"""" และใช้ชื่อนั้นเรื่อยมา จนกระทั่งเมื่อวันที่ 26 มิถุนายน 2556 กรรมการองค์การสวนสัตว์ ได้มีมติให้เปลี่ยนชื่อมาเป็น """"สวนสัตว์ขอนแก่น"""" พร้อมทั้งให้สวนสัตว์ขอนแก่นเปิดบริการเก็บค่าบัตรผ่านประตูสวนสัตว์ขอนแก่นบริหารจัดการพื้นที่ภายใน แบ่งออกเป็น 2 ส่วน คือ ส่วนการศึกษา จัดให้เป็นแหล่งเรียนรู้และศึกษาทางด้านการอนุรักษ์พันธุ์สัตว์ป่าหายาก เป็นศูนย์วิจัยเพาะเลี้ยง และเป็นการท่องเที่ยวแบบอัธยาศัย รวมทั้งกิจกรรมการเดินป่าศึกษาธรรมชาติ กิจกรรมโครงการนักเรียนเข้าเรียนรู้ในสวนสัตว์ โครงการแค้มป์ปิ้ง โครงการกิจกรรมค่ายลูกเสือและยุวกาชาด รวมถึงศูนย์ประชุมสัมมนา ส่วนจัดแสดงสัตว์ Zoo Zone จัดเป็นแบบลักษณะสวนสัตว์ปิด ไม่สามารถนำรถยนต์เข้าไปเที่ยวชมได้ ซึ่งทางสวนสัตว์ได้จัดเตรียมพาหนะไว้บริการ คือ รถออโต้แทรม รถจักยานบริการ รถกอล์ฟบริการ และการเดินชมสัตว์ตามเส้นทาง",บันเทิง,ขอนแก่น,เขาสวนกวาง,คำม่วง,88 หมู่ 8,40280,20,100,กลุ่มครอบครัว/กลุ่มผู้สนใจด้านการอนุรักษ์ธรรมชาติ/,รถยนต์/เดินเท้า/มอเตอร์ไซค์/จักรยาน/,,"08 6455 6340-1, 0 4330 6424, 08 6459 4192",khonkaenzoo@gmail.com,www.khonkaenzoo.com,ทุกวัน 08.30-16.30 น.
15,หมู่บ้านงูจงอางแห่งประเทศไทย บ้านโคกสง่า,,บันเทิง,ขอนแก่น,น้ำพอง,ทรายมูล,114 หมู่ 6 บ้านโคกสง่า,40140,20,40,กลุ่มครอบครัว/,รถยนต์/รถโดยสารประจำทาง/เดินเท้า/มอเตอร์ไซค์/จักรยาน/,,08 8334 9618,ไม่ทราบ,ไม่ทราบ,ทุกวัน 09.00-17.00 น.
16,วัดไชยศรี,สร้างขึ้นเมื่อปี พ.ศ.2408 สิ่งที่น่าสนใจคือภาพจิตรกรรมฝาผนังที่ดูสวยงามแปลกตาฝีมือนายทอง ทิพย์ชา ช่างพื้นบ้านชาวมหาสารคาม ภาพจิตรกรรมที่วัดนี้จะเขียนทั้งภายในและภายนอกสิม(โบสถ์) สิ่งที่สะดุดตาอันดับแรกคือการใช้สี ช่างจะเขียนด้วยสีฝุ่นโทนสีคราม เหลือง ขาว มองสบายตา ลักษณะการเขียนภาพเน้นสัดส่วนที่เกินจริง อารมณ์ของภาพดูสนุกสนาน ตัวละครจะออกท่าทางโลดโผน เรื่องราวที่เขียนบนฝาผนังด้านนอกเป็นรูปนรกแปดขุม ภาพพระเวสสันดร นิทานพื้นบ้านเรื่องสังข์สินไชย ภาพทวารบาล ส่วนด้านในจะเล่าเรื่องพุทธประวัติ มีภาพเทพ มนุษย์และสัตว์ต่างๆ แต่ปรกติวัดในต่างจังหวัดยังคงเคร่งตามประเพณีเดิม คือผู้หญิงไม่สามารถเข้าไปภายในโบสถ์ได้ ซึ่งวัดไชยศรีก็เป็นวัดหนึ่งที่ยังรักษาธรรมเนียมนี้อยู่ลักษณะทางสถาปัตยกรรมของสิมโบราณ เดิมเป็นหลังคาแบบอีสานคือมีปีกยื่น ต่อมาหลังคาชำรุดชาวบ้านจึงร่วมกันปฏิสังขรณ์ใหม่เป็นแบบรัตนโกสินทร์ซึ่งไม่สามารถกันแดดกันฝนได้ทั่วถึงจึงทำให้ภาพจิตรกรรมที่ผนังด้านนอกเลือนไปบ้างแต่อย่างไรก็ดีกรมศิลปากรก็ได้เข้ามาต่อเติมปีกด้านข้างของโบสถ์แล้ว นอกจากนั้นยังยกพื้นขึ้นเพื่อป้องกันน้ำกัดเซาะฐานด้วย,ศาสนา,ขอนแก่น,เมืองขอนแก่น,ในเมือง,หมู่ 8 บ้านสาวะถี,40000,0,0,กลุ่มครอบครัว/กลุ่มวัยทำงาน/กลุ่มนักเรียนนักศึกษา/เยาวชน/วัยรุ่น/กลุ่มคู่รัก / คู่แต่งงาน/ทุกช่วงวัย,รถยนต์/รถโดยสารประจำทาง/เดินเท้า/มอเตอร์ไซค์/จักรยาน/,ลานจอดรถ/ลานจอดรถ/สุขา/ร้านอาหาร/ศูนย์บริการนักท่องเที่ยว/ร้านขายสินค้าที่ระลึก/มัคคุเทศก์ท้องถิ่น/ป้ายสื่อความหมาย/ป้ายชี้ทางเข้าถึง/ที่พักสัตว์เลี้ยง(สุนัข)/ที่พักสัตว์เลี้ยง(แมว)/ที่พักสัตว์เลี้ยง(อื่นๆ)/,08 9276 4202,wchaisri139@gmail.com,m.facebook.com/260639874026537,เปิดบริการทุกวัน เวลา 08.30 -18.00 น.
